{
  "schemaVersion": 1,
  "fixtureId": "collection-expression-12",
  "inputHash": "1f69756117e3e558f5f8bdbafa04abcc3b1a6a299460ec8b96de7164f71f1cdf",
  "oracleId": "roslyn",
  "toolVersion": "5.3.0-2.26153.122 (4d3023de605a78ba3e59e50c657eed70f125c68a)",
  "target": "linux-x64",
  "toolchain": {
    "sdk": "10.0.201",
    "runtime": "10.0.5",
    "roslyn": "5.3.0-2.26153.122 (4d3023de605a78ba3e59e50c657eed70f125c68a)",
    "referencePack": "10.0.5",
    "windowsAppSDK": null
  },
  "langVersion": "12.0",
  "result": {
    "exitCode": 0,
    "diagnostics": [],
    "assemblySHA256": "b8757d4fecf9dbceac0d120e785c0175564fbade770b18253a19f2570640e372"
  }
}
