{
  "schemaVersion": 1,
  "fixtureId": "bcl-collections-culture",
  "inputHash": "bc61bdca7ec4b6aa8fd062128d7188c749fabbb1de2857b648a309f73868fd75",
  "oracleId": "roslyn",
  "toolVersion": "5.3.0-2.26153.122 (4d3023de605a78ba3e59e50c657eed70f125c68a)",
  "target": "win32-x64",
  "toolchain": {
    "sdk": "10.0.201",
    "runtime": "10.0.5",
    "roslyn": "5.3.0-2.26153.122 (4d3023de605a78ba3e59e50c657eed70f125c68a)",
    "referencePack": "10.0.5",
    "windowsAppSDK": null
  },
  "langVersion": "12.0",
  "result": {
    "exitCode": 0,
    "diagnostics": [],
    "assemblySHA256": "251d9821e48f62a7e37b469d57e6242cd86ccd2c37b8c3e9395ccd02e22d26e0"
  }
}
